"Cashier optimization system,that reduces client wating time.","Automated cashier optimization system, that reduces client waiting time, maximize cashier efficiency, and reduces required number of cashier. Client wins because he is less time wasted in line.","[""inspiration came to me very easily. I often go to the hypermarket for groceries, I did not like the fact that I lost a lot of time in the queue, therefore I decided to write an algorithm that would optimize cashiers ! :)I understood that there are peak hours when there are a lot of buyers, and there is a time where cashier are sitting idle. I contacted to this hypermarket IT department (one of the largest hypermarkets in our country, more that 80 hypermarkets). After some time, After a while, we agreed and signed documents that I will try to make a better decision. it turned out that before that they already had a similar system, but it did not work)The problemView from the client’s perspective:it takes a lot of time while the client is standing and waiting for his turn at the checkout (~ 15 min on average). There is a high probability of client outflow.View from the business perspective:the company understands that if the number of cashiers is increased, then the customer waiting time will decrease. However, by increasing the number of cashiers the company does not come to satisfactory results; on the contrary, expenses increase due to an increase in payroll.Challenges I ran intoWe agreed that I will complete project in one month, but i spend about 6 month, because project was for real production, and there was many problems that i must to solve.Accomplishments that I'm proud ofI'm glad that with a simple idea, the project turned into a really useful program, here is an example of saving money.N branches x M employees x payroll x 12 months = total payroll expenses• It WAS 40 x 40 x 1000$ x 12 = 19 200 000 dollars per year• It BECAME 40 x 30 x 1000$ x 12 = 14 400 000 dollars per year• Benefit: 720 000 000 (decrease of payroll by ~ 25% )What's next for Cashier optimization system,that reduces client wating time.Built Withforecast.iooptimizationpythonrretai    Created by  Динислам Ораз\n"", '\n', '\n', 'We agreed that I will complete project in one month, but i spend about 6 month, because project was for real production, and there was many problems that i must to solve.\n', ""I'm glad that with a simple idea, the project turned into a really useful program, here is an example of saving money.N branches x M employees x payroll x 12 months = total payroll expenses• It WAS 40 x 40 x 1000$ x 12 = 19 200 000 dollars per year• It BECAME 40 x 30 x 1000$ x 12 = 14 400 000 dollars per year• Benefit: 720 000 000 (decrease of payroll by ~ 25% )What's next for Cashier optimization system,that reduces client wating time.Built Withforecast.iooptimizationpythonrretai    Created by  Динислам Ораз\n"", '\n', '\n']","['python', 'r', 'forecast.io', 'retai', 'optimization']","False","7","['dinislamos1']","defaults/thumbnail-placeholder.gif","False","0"
"chat-bot","chatbot created by CodesBot PSIT","['\n', '\n', '\n', '\n', '\n', '\n', '\n']","['python', 'tkinter', 'machine-learning']","False","0","['sushantag9']","","False","0"
"know-bot","A knowledge management solution that delivers everything you need. Spend less time searching &amp; more time doing whatever it was you were actually hired to do.","['A knowledge solution in a fraction of the time. Starting from scratch can be really rewarding. But when you’re implementing a knowledge management solution, it’s probably a good idea to start with one of our frameworks. Browse the library of frameworks to get started.\n', 'Expert-approved knowledge that lives where you work and finds you when you need it. There’s no need to search, so you can spend your time doing what you do best: Creating amazing customer experiences, closing deals, building for the future, and cleaning up garbage once and for all. \n', 'Capture knowledge from all available sources (documentation, emails, chats etc...) Transform knowledge data into unified format. Deliver and get access thru multiple channels  \n', 'As always it was integration with different knowledge sources\n', 'In 2 days of Hackathon we build a MVP and take the 1st place\n', 'Google Dialogflow\n', 'Investment from company for making this project product.\n']","['javascript', 'html', 'css', 'node.js']","False","1","['alexanderperman']","","False","0"
"iotpayments","Let the IoT devices make automatic payments by themselves and owner will only authorize it","['\n', '\n', '\n', '\n', '\n', '\n', '\n']","['ruby', 'html', 'css', 'javascript', 'coffeescript']","False","1","['alexanderperman']","","False","0"
"Timy","Best way to send scheduled messages in Slack","['\n', '\n', '\n', '\n', '\n', '\n', '\n']","['slack']","False","0","['thusitha']","https://challengepost-s3-challengepost.netdna-ssl.com/photos/production/software_thumbnail_photos/000/882/540/datas/small.jpg","True","0"
"Detecting-Ships","Using Satellite Imagery to detect ships (Basic Object Detection)","['\n', '\n', '\n', '\n', '\n', '\n', '\n']","['jupyter-notebook', 'python']","False","0","['ucalyptus']","","False","0"
"EarthEngine-Deep-Learning","Land Cover Classification based on Landsat-8 imagery from Google Earth Engine","['\n', '\n', '\n', '\n', '\n', '\n', '\n']","['html']","False","0","['ucalyptus']","","False","0"
"Pneumothorax-Segmentation-using-Hypercolumns","Pneumothorax-Segmentation-using-Hypercolumns","['\n', '\n', '\n', '\n', '\n', '\n', '\n']","['jupyter-notebook']","False","0","['ucalyptus']","","False","0"
"BS-Nets-Implementation-Pytorch","BS-Nets: An End-to-End Framework For Band Selection of Hyperspectral Image","['\n', '\n', '\n', '\n', '\n', '\n', '\n']","['jupyter-notebook']","False","0","['ucalyptus']","","False","0"
"Testing","Testing and learning of AI","['\n', '\n', '\n', '\n', '\n', '\n', '      Submitted to    #TFWorld TF 2.0 Challenge!    Created by  Govind Ghatnandrekar\n']","","False","0","['govind23']","","False","0"
"SHHHUT ALERT","Edit","['Edit\n', '\n', '\n', '\n', '\n', '\n', '      Submitted to    ESE 111, Atoms, Bits, Circuits and Systems (Pappas/Deliwala)    Created by  Sai Mamidala\n']","","False","0","['smamidala27']","","True","0"
"Puzzle of the Day","A daily crossword puzzle game - designed from the ground up only for Alexa","['I\'ve always been interested in building games for voice, as voice is such a different medium than the visual ones we are bombarded with throughout the rest of our day. Voice games are a perfect time to sit back, use your imagination, and really immerse yourself in something, similar to reading a book. It activates your brain in ways you don\'t get from your phone, your TV, your consoles, or your computer.I\'ve built games for Alexa in the past, but for this competition I wanted to focus on something specific, and that was retention. Generally most voice games don\'y have great retention - you play it once, finish the content within a week or so, and you\'re over it. While that can provide for an engaging experience, it\'s not always the best path forward for something like ISP. To make some income, you really want people coming back time and time again.Despite the rise of technology in our day to day, and the decline of traditional newspapers, there is still a massive community of crossworld puzzlers around the globe. People still keep their subscriptions solely for the daily crossword. Crossword puzzles and their fun clues are an amazing brainteaser, forcing you to think deeply about words and their meanings, learning and having fun at the same time. Voice seemed like the perfect medium to translate this sort of experience. Voice games are especially great for those ""in-between times"". It\'s something you can do when you wake up, when you are doing the dishes, doing the laundry, driving etc. You may be doing something mindless with your hands, but still want to engage with your brain. These were the times of day I wanted to target.With an idea in mind, I set to work!\n', ""Puzzle of the Day is a daily crossword puzzle style game. The puzzles are built from the ground up for Alexa, and are designed as quick 5-10 minute daily experiences.Each puzzle consists of five words, and a theme.It uses clues similar to those you may find in a crossword puzzle, but removes the crossing component from the game. Instead, solving words give you free 'letter reveals' which act in the same way, but you can be strategic about when to use them. If you are stumped on a hard word, you can pass and rack up some letter reveals to help you with that one later.Once the user guesses all five words, they can wager some points on the theme. Points are earned from solving words, having remaining letter reveals, as well as time bonus for finishing under 5, 10 and 15 minutes. You only get one guess for the theme, but guessing correctly with a high wager could let you double your points.Once solving each daily puzzle, you can see how your score compared to others around the world with an in game leaderboard, giving you your percentile and place for time and points for each day. Users who are more interested in the stats can link their accounts and access the online leaderboards that I built for the game. These are available at https://www.stokedskills.com/puzzleoftheday/You can also set up the email service to get a daily email at the end of the day, so you can see how you compared against all the users of the day (because when you play, you can only get stats for people who played thus far)\n"", ""There are a number of components to this skill:The skill code itself:I built this skill using the Jovo framework. It is developed in Node.js using typescript, and data for each user is being persisted to the skill in DynamoDb. The skill supports the APL interface and has full screen APL support across for all devices, throughout the whole game.The Leaderboards:The leaderboard data can be accessed within the skill, from the website, or from the email service. Leaderboard data is updated whenever a user finishes a puzzle, and is stored in and AWS RDS MySql instance.The Website:The website allows users to view their rankings on a 7 day / Last Month / All time basis. You can look up your user and see your scores for each puzzle you completed. This out of skill component was designed and built to help with user retention. It's built as a static site hosted and Amazon S3, written with javascript in VueJS. Data is accessed via a backend node API hosted in AWS Lambda and API Gateway using the serverless framework. The Email Service:To send emails to users, there is a recurring job each day.  Once a day is completed and we have everyone's scores, we can publish that days results. Using an AWS lambda running on a cron schedule daily, we load up all the scores from the database for the previous day for users that have requested emails. For those users, we calculate their individual stats for percentile and place in time and points and deliver it as an email using Twilio's SendGrid. This system was an integral part of the design as I really wanted to focus on user retention to drive adoption of the ISP.The ISP: For the In Skill Purchase component of the skill, I decided to go with subscriptions. Since I was focused on retention and daily usage, I figured that a recurring model would be the best approach for this skill. I've decided to brand the ISP as the puzzle league, and by subscribing users get extra benefits like more games, and the ability to reveal extra letters. The free component to the game is substantial, but by paying a small monthly fee, those dedicated users can get some extra enjoyment and fun.\n"", ""Because I wanted to build a game of high quality, I included alot of features which increased the scope. Besides the skill itself, I needed to build out the website, the database system for the in-skill leaderboards, and email system, and a content management framework. While building the skill itself, and all the other moving parts were quite a challenge and took lots of iteration to get right, I think the content management aspect was the most interesting challenge I had to face so I wanted to focus on that.Building a daily recurring game means more content every day. To make this word right and with accurate word recognition, I needed to include all of the solutions to the puzzles, including the themes, into the voice model. This means re-certifying with every new puzzle that is added. I could have taken a more risky approach and used an 'open' slot with SearchQuery, but I really wanted the accuracy to be top notch so I took the more involved approach.To get all the data into the skill, I needed a great way to manage the content. Instead of managing the puzzle content in code, I decided it would be way easier to use spreadsheets. In the spreadsheet I can fill in the solutions, the clues, and the themes.From there, I needed to get it into the slots of the skill, and access it from within my skill code. To do so, I built a number of deployment scripts. These scripts are used to do a number of things:Import the spreadsheet into code and convert it into JSON, so the skill code can use it to provide the right puzzlesAutomatically fill in dates and data for all the new puzzles that are addedRun some verification on the generated JSON file to make sure there are no duplicate dates, puzzleIds, etcTake all the words I need from the JSON file in the voice model, (clue answers and theme names) and open up the voice model json file, update the slot values, and save it back to disk so that I could use that to upload to the Alexa service.Upload all the puzzle data into MySql so the website has access to the correct puzzle dataThese scripts allow me to do all the data management I need in only a minute or so, saving me alot of time and potential errors in the future. With this system, I plan to create skill content every 2-3 months, and then update the skill with that data, giving me a nice worry-free window in case things are slow with certification. By automating the process, I can make all those above updates that are pretty far reaching into all of the infrastructure and code of the entire system, without touching the code myself. This really limits the vectors for failure and allows me to spend more of my time focusing on how to improve the game for customers.\n"", ""With all the moving parts, this was probably the most complicated and in depth skill I've built. It's the first one I've built using Subscriptions as an ISP. After spending alot of time on the design, and considering cutting alot of the scope, I'm proud that I completed everything I set out to do, and that I designed it in an efficient and scalable way that requires little maintenance. I'm excited to see how it performs now that its out there in the wild! \n"", ""Skill development is an amazing learning process, and I learned a ton with this project. While I had experience with some of these technologies before, I took steps to learn and include more technologies whenever I got the chance. For example, as part of this project I learned Typescript and built the entire skill using it. Being my first time using Typescript, it took at bit of studying up, but I think it paid off in the end and my skill is far more maintainable that it would have been without it. I also learned the importance of user testing. As part of the process, I recruited people that I knew to act as beta testers and play through the game for a few weeks before the release. This really allowed me to tweak the difficulty and gameplay and find a level where I think people will gain the most possible enjoyment. As I went through a couple iterations of this I found that each and every piece of feedback I acted on had an immediate effect on the next group of people I had try the game. It's definitely a process that I will continue doing on future projects. \n"", ""Now that I have everything set up and rolling, the next step is to iterate and improve the experience. Nothing is ever quite perfect on the first try, and that is why I set up a feedback system within the skill. Each day, users can rate the quality of the puzzle. This is stored into my database and I can use it to help me understand what is working and what isn't as I build more puzzles for the future.In addition, I want to iterate on the ISP. I want to find more ways to add value to subscribers with the potential for weekly challenge puzzles, or monthly competitions. I'd love to build out an A/B testing framework for this game so I can truly identify what is working and make smart analytical decisions about where to invest my time next. \n""]","['mysql', 'vuejs', 'node.js', 'lambda', 'amazon-dynamodb', 'jovo', 'amazon-alexa', 'javascript']","False","0","['gshenar']","https://challengepost-s3-challengepost.netdna-ssl.com/photos/production/software_thumbnail_photos/000/882/494/datas/small.png","True","0"
"Weave Bookmarks","Secure Bookmark Manager for permaweb","['\n', '\n', '\n', '\n', '\n', '\n', '\n']","['arweave', 'react', 'arql', 'arweavejs', 'arweavedeploy']","False","0","['anchanviraj']","https://challengepost-s3-challengepost.netdna-ssl.com/photos/production/software_thumbnail_photos/000/882/479/datas/small.png","False","0"
"Portal","Breaking the media accessibility barrier using AI, Canon's API, and Filestack's API","['An estimated 80% of digital camera users suffer from inconveniences with accessing photos from their cameras.\n', 'Portal is a service that automatically upload photos from the digital camera to a database presented on the platform that can be accessed from anywhere in the world. Unclear photos can be filtered out based on blurriness, photos can be edited, and shared on social media platforms all in one platform. \n', ""Platform uses Canon's CCAPI to automatically fetch media from the digital camera. The content is then stored using Filestack and edited using the Filestack's API.\n"", 'The unstable public WiFi connection caused significant latency in media uploading.The CCAPI has limited usages, and caused compatibility issues on MacOS (could not set up).\n', 'Released a functional prototype within the limited time frame, despite challenges.\n', ""Capabilities of digital camerasHow to use and implement Filestack & it's API\n"", 'Cross-platform with mobile devices\n']","['javascript', 'angular.js', 'ccapi', 'filestackapi']","False","0","['davidho104', 'harrmalik', 'aspecting', 'locvicvn1234', 'relvingonzalez']","https://challengepost-s3-challengepost.netdna-ssl.com/photos/production/software_thumbnail_photos/000/882/445/datas/small.jpg","False","0"
"Filestack Hack","A wonderful user experience enhanced by the Filestack API offerings.","['The API is so well documented, a developer can only imagine how quick it will be to build with!\n', 'This app utilizes the Filestack file picker and Workflows!\n', 'With React, very slowly.\n', 'Authentication, UI flow\n', 'This thing is live and works and almost looks not bad!\n', 'The simplest things can take so long to build, and break so easily.\n', 'This user-onboarding app can be used to create future projects!\n']","['react', 'firebase', 'filestack', 'bootstrap']","False","0","['dissolutio']","","False","0"
"VetsUnited","Veterans United","['\n', '\n', '\n', '\n', '\n', 'How to use the Filestack API in a very short period of time.Built Withcssfilestackapigoogle-mapshtmljavascriptmeteor.jsmongodbnode.js      Submitted to    DeveloperWeek Austin 2019 Hackathon    Created by  Zachariah Col\n', '\n']","['filestackapi', 'google-maps', 'html', 'css', 'javascript', 'mongodb', 'meteor.js', 'node.js']","False","0","['zachariahcol']","","False","0"
"Backup+","Backup+ organizes all of your cloud backup files using Filestack's API. Simply drag and drop the files you want to backup and Backup+ will take care of the organization.","[""As a student, I have hundreds of unorganized documents on my phone and never have time to organize it all. Once I discovered the power of Filestack's API, I knew it was the answer to all of my problems.\n"", 'Backup+ handles all of your document organization needs. Simply drag and drop the files you need to backup/organize and Backup+ will tag and organize all of your files automatically.\n', ""Backup+ is built on a standard HTML/CSS/Javascript stack and powered by Filestack's API. On top of this, we use APITracker to monitor the API\n"", 'This was my first time working with APIs so it came with a big learning curve but I am glad I stuck with it and now I have a skill that is very valuable \n', ""I'm proud of the fact that we were able to create a product that normally takes days to finish in only 24 hoursBuilt Withapitrackerbootstrapcssfilestackapijavascript      Submitted to    DeveloperWeek Austin 2019 Hackathon    Created by  Steve Nguyen\n"", '\n', '\n']","['javascript', 'css', 'filestackapi', 'apitracker', 'bootstrap']","False","0","['red_ozarka']","https://challengepost-s3-challengepost.netdna-ssl.com/photos/production/software_photos/000/882/422/datas/small.PNG","False","0"
"Web Shooter","Let your photos organize themselves. ","['We wanted to create a developer tool that made it easy for us to utilize images taken straight from the camera. \n', 'A web application for auto-uploading and performing QA/QC on photos taken with compatible Canon cameras.\n', '\n', 'We had a hard time finding APIs we could use that were free, and none of the challenge APIs did precisely what we expected them to do. \n', 'Completing the landing page, implemented oauth, working in new stacks\n', '\n', '\n']","['html', 'css', 'react', 'javascript', 'ccapi']","False","0","['kieuthihuynh22', 'eriese', 'scook12', 'tamjojo2000']","https://challengepost-s3-challengepost.netdna-ssl.com/photos/production/software_photos/000/882/375/datas/small.gif","False","0"
"Math Rocket","Jeff and his crew power through the Solar System with your math skills, awarding you stars as you progress. Give a wrong calculation and the Math Rocket will be in danger and you lose it all!","['I wanted to create a fusion of a storyboard adventure with a question & answer quiz format, but with a custom environment that would immerse the user. Math Rocket is my first attempt at creating this format of game and I think it does a good job of taking the player into the unique environment, in this case Space, to wrap around basics of the gameplay.\n', ""You take the role of 'commander' at mission control. You are tasked with answering the communications coming from Jeff and his crew aboard the Math Rocket. Jeff will explain to you the situation they have and you will provide him with the response using your math skills. You are awarded stars as you progress with each correct guidance Jeff receives. If you give Jeff the wrong guidance, you put the Math Rocket in danger.  If the Math Rocket is in danger you are able to send a rescue mission by using your lifelines. If you choose not to, you lose the Math Rocket, your stars and have to start a new mission.You can replenish lifelines using consumable lifeline ISP packs, and you can also assist your progress by unlocking the one-time hint mode entitlement ISP. With hint mode, Jeff will give you his best guess and Alexa will breakdown his problem into raw math.Players compete to get the most stars collected and those that manage to leave the Solar System are added to the 'all-time' leaderboard.\n"", 'The game incorporates a number of features including: APL, ISP and Reminders. APL is integrated into the voice-first experience to show at a glance progress and status. ISP integrates two product types, consumables and entitlements. Upsells are effectively integrated into key moments of gameplay, such as lack of lifelines or requirement of a hint. Reminders allow users to have a notification at a time of their choice to continue their mission and should help with repeat engagement. Built using node.js and an AWS backend, the game is unique in that every question provided is custom audio, with background noise, voice actor and special audio effects. I created level-based scripts to keep the quantity and variety of questions somewhat unique and increase in complexity as the player gets past milestones and virtual levels.\n', 'The design of voice and music was new for me, particularly in order to match it with the particular mood of the game. \n', 'Overall, aside from programming factors, I think I created a decent variety of audio elements and immersive intro, questions, responses and outros. \n', 'I have gained a lot of knowledge on workflows for story-boarded adventure games and am hoping to create many future titles but with completely custom questions and multi-level scenarios. \n', 'Before I begin another title, I want to return to Math Rocket to create a more diverse question set as part of an add-on ISP packages. These will be completely custom created audio and questions and lead to 100 percent variety and add a touch of humour to the game too.\n']","['node.js', 'amazon-web-services', 'amazon-alexa', 'alexa-skills-kit', 'database', 'apl', 'isp']","False","0","['rayanarman']","https://challengepost-s3-challengepost.netdna-ssl.com/photos/production/software_photos/000/882/939/datas/small.png","True","0"
