"SnoozersBeLosers","You drive lousy when you are drowsy!","['An estimated 1 in 25 adult drivers (aged 18 or older) report having fallen asleep while driving in the previous 30 days.\n', 'Detects if the driver driver is drowsy before they fall asleep completely and rings an alarm, warning the driver to either pullover or pay more attention\n', 'We used the opencv library to be able to map the whole face in terms of coordinates. We extracted eye coordinates that gave 6 specific points on the plane. Using the Euclidian geometry, we found out if the eye lid is closing with putting limitations in relation to the timespan it occurs. Not relying just on the coordinates and to be more precise and efficient we trained a model using Microsoft ML, which analyses if our given frame is a frame with closed or open eye. The training set was images of people with eyes open and closed while the classifier predicts if the driver has his eyes on the road or not.\n', 'Deciding out of the 6 coordinates, which anticipates the most accurately if the driver is feeling drowsy.\n', 'Detecting facial landmarks from live video stream.\n', 'Learnt a lot about openCV library.\n', 'detecting drowsiness provided driver is wearing opaque glasses or under conditions when eyes are not visible.\n']","['python', 'opencv', 'microsoft', 'ml']","False","2","['araheja', 'tmahendran']","https://challengepost-s3-challengepost.netdna-ssl.com/photos/production/software_photos/000/883/141/datas/small.jpg","False","0"
"Dermax","DerMax is a personal AI skincare disease assistant, which can help patients self-diagnose skin disease and connect the best dermatologists in their vicinity. ","[""Skin cancer is one of the most commonly diagnosed cancer in the US, and other parts of the world alike, though most cases are preventable. The number of people diagnosed with skin cancer in the last three decades is higher than all previous decades combined, and that number is still increasing. $8.1 million dollars a year goes to skin cancer treatment, with $3.3 million alone attribute to melanoma. The ratio of dermatologists vs patients with skin diseases some of the third world countries is 1:6700. Thus, it becomes challenging for patients to find dermatologists and bear a huge financial burden for themselves, their families and substantial healthcare costs for the nation's economy. Earlier diagnosis can prevent patients from missing the best time of treatments, hence can reduce the costs of treatment and avoid complications. It can also be a powerful tool in helping doctors to make a faster, more reliable and more efficient diagnosis of the diseases. We see great potential in technologies like artificial intelligence with various applications in the healthcare industry, which in turn inspires us to use it for solving skin disease prediction problems, to make this world a better place for everyone. In this hackathon, we have developed ‘DerMax’, a personal skincare assistant. \n"", 'Our proposed product, ‘DerMax’, is a personal skincare assistant that can be used to check if one has any skin disease and by dermatologists, providing an extra hand/brain to create a faster diagnosis of skin diseases. We have created a basic website, on which a patient suspected to have some skin disease, can upload a picture of the affected skin region, and at the backend, our image classifier classifies into one of the 10 possible skin diseases. The website then generates a result that shows the probability of the patient having one of the 10 diseases. If the model predicts a high probability of particular skin disease, we plan to direct the patients to one of the best dermatologists in his/her vicinity, decided by a PageRank-like algorithm and can be visualized on the google maps, which is integrated into our website. \n', 'We got an open-source dataset for Skin cancer MNIST dataset from Kaggle, which classifies skin lesion images into either cancerous of skin-disease category. We trained a Resnet 50 classifier on 10,000 images (without data augmentation) and 40,000 images (with data augmentation - flip, mirror, grayscale images, etc.) and classified it into 10 different skin disease classes. We used the pre-trained weights of ResNet50 from the ImageNet dataset and did transfer learning by learning the weights of the final layer. The best accuracy that we received on the validation set was 78.2% while training the model for 50 epochs. We plan to improve on this model’s accuracy by taking the following steps:\n', 'We faced many difficulties while working on this. Firstly, it was a little difficult to get an open-source dataset from the internet, and after searching for a long time, we got a dataset on SKIN CANCER MNIST from Kaggle. Secondly, it was to identify the right model architecture, which could potentially learn the subtle features that differentiate one skin-disease from others. While training the network, tuning the hyperparameters, like the number of neurons in the final layer, learning rate, dropout probabilities, etc. took a substantial amount of our time. Combining machine learning pipeline to the website without compromising any features is one of the tough ones, as we didn’t stop to just make a mock-up but wanted to complete it as a whole. \n', ""Our team is proud of the fact that out of many interesting ideas that we brainstormed, we could work on something which has a direct impact on people's health globally, in a very short span of time. We as a team believe that working on challenging problems with powerful technology like artificial intelligence will dramatically help democratize healthcare to the hands of people. \n"", 'We learned what it means to work with people of different backgrounds, with diverse skill sets. While reading on the scale that this can affect people, we as a team would thrive to find such problems in society, and use the latest technologies to solve them. We learned how difficult it can be to tune parameters of a machine learning model, and what goes into building a technology that can impact multiple domains, right from healthcare, to autonomous cars, robotics and much more. \n', 'We are committed to taking this project to the next level by making the algorithms better and enhancing the user experience. We believe we have a decent revenue model for the project to sustain itself by bringing various stakeholders like doctors, patients, and research organizations. Given a chance, we would like to help organize the event, popularize the events to gather much more foot-falls and make hackholyoke 2020 an even bigger event! PresentationYou can have a look at our beautiful presentation of the project atPrezi.\n']","['html', 'python', 'keras', 'flask', 'github', 'tensorflow', 'numpy']","False","1","['hangnt0610', 'neerajajaysingh17', 'sylviale', 'nmaryala']","https://challengepost-s3-challengepost.netdna-ssl.com/photos/production/software_thumbnail_photos/000/883/170/datas/small.png","True","0"
"ryde.","We aim to improve ride sharing experience for both drivers and passengers. We want to introduce new features to existing rideshare apps. Some examples are scheduled rides &amp; accurate identification.","['\n', '\n', '\n', '\n', '\n', '\n', '\n']","['android-studio', 'java', 'xml', 'moqups']","False","0","['khuerta', 'primal', 'jebell21']","https://challengepost-s3-challengepost.netdna-ssl.com/photos/production/software_photos/000/883/057/datas/small.png","False","0"
"InsideOut","A machine learning mood ring!","['\n', '\n', '\n', '\n', '\n', '\n', '\n']","['jupyter-notebook', 'python']","False","4","['cgm616', 'abbas24a', 'khe']","https://challengepost-s3-challengepost.netdna-ssl.com/photos/production/software_photos/000/883/066/datas/small.jpg","False","0"
"Doodle Sounds","A applet that sonifies your doodles based on the color, direction, and velocity of your drawings.","['\n', '\n', 'We used Java to run an applet. We created a recording class to save the recording data as a hashmap of timestamps and speeds/locations. We saved each musical note as a discreet audio file and played them back in the recording class. \n', 'Originally, we wanted to create a website to make the app more accessible, however we did not have the knowledge to host it. We ran into some aesthetic challenges, such as the difficulty of creating a visually pleasing interface because we did not use a scripting language. The main challenge was getting the audio to play in the applet and having it play at the speed we hoped. Additionally, we did not have enough time to implement the ability to play the various recordings concurrently.\n', 'We are proud that we were able to finally get the sound to function despite it not working as smoothly as we would like. We also are proud of our teamwork in a team of two with only one experienced in computer science!Built Withjava      Submitted to    HackHolyoke 2019    Created by  As someone with no computer science experience, this project was a great learning experience where I got to work on a project related to the my interest in arts and music. Anna MorrisMariah Papy\n', '\n', '\n']","['java']","False","0","['annapmorris', 'mariahpapy']","https://challengepost-s3-challengepost.netdna-ssl.com/photos/production/software_thumbnail_photos/000/883/095/datas/small.png","False","0"
"EcoTribe","Objective:  Recycled lending, creating a cycle of success, where those who borrow can access funds from a decentralized pool that is generated through the Ethereum blockchain network.","['\n', '\n', '\n', '\n', '\n', '\n', 'NSBE de-centralized currencyUse for shared goals towards the NSBE mission i.e. saving for conferences to succeed professionally, purchasing study materials and supplements to excel academicallyfundraising for social impact goals to positively impact the community.Automated Role ContributionsHave increments of contributions sending pre-set based on financial activity monthly\n']","['javascript', 'react']","False","0","['favour']","https://challengepost-s3-challengepost.netdna-ssl.com/photos/production/software_photos/000/883/054/datas/small.png","True","0"
"The Altar of rDAI","A UX experience that allows users to use their DAI to support the open source projects present at ETHWaterloo using rDAI interest.  Also with Twitter virtue bragging.","['We wanted to create an rDAI-powered open source support tool that conjured the numinous and encouraged humblebragging.\n', ""The Altar of rDAI provides an immersive and spooky UX experience designed to encourage using idle DAI to support open source projects that are represented here at ETHWaterloo through donating rDAI interest.  It also provides a Twitter humblebrag virtue signaling integration to tout one's generosity in a visually compelling way.\n"", '\n', '\n', '\n', '\n', 'Perhaps sparing you puny humans, should your offerings please me.\n']","['react', 'javascript', 'tribute.js', 'figma', 'ens']","False","0","['vrortvedt', 'arnav1gup']","","False","0"
"House Rules","For people sharing a living space with others, House Rules gamifies chores, incentivizing their completion and in a fun and fair way.","[""Once upon a time, our team members' roommate significantly inconvenienced said team member and essentially left the team member responsible for cleaning up after him. This team member endured great hardship and after sharing similar experiences with the rest of his soon to be Hackathon team, the idea for House Rules was conceived.\n"", ""House Rules gamifies the process of completing chores by incentivizing finishing them on time in a fun and fair manner. Specifically, it assigns a monetary value to each chore and based on some cycle length and deadline agreed upon by the house, the app will randomly assign the chores to the members of the house. At the beginning of each cycle, house members are charged for the cost their assigned chores are worth. Then, each member has until the chores' specified deadline to complete the chore or they risk losing the money they were charged. In the event they complete it on time, they will receive the corresponding amount back, however, in the event that the chore remains incomplete, it becomes available for others to take on and win the amount the chore is worth. Moreover, House Rules provides a feature for compensating those who incurred significant hardships in their living situation, separate from recurring chores, such as cleaning up after a party or utility maintenance. When a hardship charge is requested, to keep things fair, either a supermajority of the house or the accused must confirm there was indeed a hardship for the payment to go through.\n"", ""To build this, we spent time planning the application's tech stack, class structure, and data flow on paper and whiteboard. This pre-planning stage helped us immensely, as we were able to divide up into two pairs, where one was more back-end focused while the other was front-end focused. We used React Native as our primary technology for developing the user interface, along with Firebase as our back-end database. \n"", 'One of the main issues we ran into was the drifting of the model interface while we were working in parallel. When we met to prepare to merge our halves together, we faced more complications than expected because we were essentially working with two dialects of the model. Furthermore, we ran into issues with separation of concerns, as we were not always clear on what parts of the pipeline our codebases were supposed to handle. \n', 'We are very proud of how the entire product came together in the end, despite us working in parallel with some setbacks along the way as we merged our code together. We believe that our idea has a lot of potential and we are excited to continue working on it beyond this Hackathon.\n', 'As a group, we learned React Native, as none of us had used the technology before in a project. Additionally, we grew together as a group and learned how to work very well with each other.\n', 'Our future plans for the application include fleshing out the UI/UX design, adding push notifications, and completing the implementations for all the features we are excited about seeing. For example, we currently do not support one user being in multiple houses, but we were careful to structure the database and data access pipeline in such a way as to easily allow this feature to be implemented. Therefore, we believe that this application is very scalable. \n']","['react-native', 'firebase', 'javascript', 'node.js', 'npm']","False","0","['denk0403', 'johnsonan2990']","https://challengepost-s3-challengepost.netdna-ssl.com/photos/production/software_photos/000/883/154/datas/small.png","False","0"
"ESE 111 Final Project - Smart Backpack","Smart Backpack","['Yes\n', '\n', '\n', '\n', '\n', '\n', '      Submitted to    ESE 111, Atoms, Bits, Circuits and Systems (Pappas/Deliwala)    Created by  Joe Konno\n']","","False","1","['joekonno']","","True","0"
"Mom Droid","A bot that reminds you to go to bed just like your mother used to. ","['As college students, sleep is a major problem. Sometimes we just need someone to tell us when to go to bed.\n', 'Mombot is an Amazon Alexa app which tells you when you should go to bed, and if you ask her to wait five minutes, she lets you know that she will come back in five minutes. If you get upset with her, she sings you ""Daisy, Daisy"" as a lullaby.\n', 'We used the Alexa Developer Console to create Mombot, and we connected it to an Alexa so that it can be used in the real world.\n', 'The Alexa Developer console was somewhat difficult to work with because its instructions were mostly in fairly long courses, and we did not have the time to do those. We had to search around to find quick, easy explanations of how to use the developer console, which made it somewhat difficult to use. The phrasing changes that we made in Daisy Daisy also does not function on the physical Alexa. \n', 'We got our Alexa to respond and talk to us. Since the developer console was so difficult to use, we are really proud of the fact that we managed to make it function consistently. We also made Alexa sing ""Daisy Daisy"" in a frustrated way, which was somewhat time consuming.\n', 'We figured out how to use ""intents"", ""slots"",  and ""utterances"" in the Amazon Alexa. We also learned about how to work with the Alexa\'s phrasing. This is the first hackathon project that three of the four of us have made, too. \n', 'Mom Droid will have more responses to questions, and it will have edited intonation to sound annoyed or comforting depending on the phrase, as well. Mom Droid will be able to have a more in-depth conversation, and it will be able to sing while not frustrated, as well. \n']","['python', 'amazon-alexa']","False","1","['elsieeigers', 'isabelk-g', 'osten22a']","","False","0"
"Emergency Scanner","We inform the public of emergencies and dangerous events in their vicinity so that they may protect themselves.","['We were inspired by the idea of placing relevant emergency and dangerous event information rapidly in the hands of ordinary people thereby giving them the power to protect and serve themselves and their communities.\n', 'Our webapp listens to local emergency frequencies via a software defined radio for keywords provided by users and sends text message alerts to them in realtime.\n', ""We setup an interface to store user's phone numbers and keywords in a database. Then we use a software defined radio to listen to local emergency frequencies and send communications through AWS transcription. We compare the result against our database and if we find a matching keyword, we send alerts via twilio to phone numbers subscribed to said keyword.\n"", 'Cleaning the noise from the software defined radio and decoding the signal presented a challenge. Differentiating the background noise from communications and clipping only when necessary to prevent data overload also presented issues. \n', 'We made a successful platform that could be expanded to many local emergency frequencies allowing more people around the country to keep informed on emergencies in realtime.\n', 'We learned a tremendous amount from creating the pipeline starting at listening to audio to obtaining a clean parsed string output.\n', 'Expand to track user location and increase software defined radio locations so that more people may subscribe to their local alerts (beyond the South Hadley area).\n']","['python', 'javascript', 'express.js', 'mongodb', 'bash', 'jquery', 'css', 'html5', 'sdr', 'rtl', 'twilio']","False","0","['tcharlan', 'sixbrigands', 'noah-huppert', 'thinhphamcs', 'derpthemeus']","","False","0"
"PixelBit","PixelBit is a picture unscrambling game","['As a group, we thought of some general categories that we could try and incorporate into our project. We thought of images and games.\n', 'PixelBit is a software that takes an image, splits it up into a number of sections, scrambles the image, then, creates a puzzle\n', 'We made use of the programming language Java and the development environment Jetbrains using IntelliJ IDEA\n', 'Programming how to upload images\n', 'Find an image from the user files\n', '\n', 'Turn the software into an app, Having the levels get progressively harder, Along with other capabilitiesA Quick Slideshowhttps://docs.google.com/presentation/d/1TmiV6C43c0hV87ruJ4m7ELZSzmMIlr7r9Ip9DWXUnhM/edit?usp=sharing\n']","['jetbrains', 'intellij-idea', 'photoshop']","False","0","['hengao', 'alphahawk7680', 'bunny20040628', 'kobez']","https://challengepost-s3-challengepost.netdna-ssl.com/photos/production/software_thumbnail_photos/000/883/222/datas/small.png","False","0"
"HearME!","We created an app solely based on Python to recognize text on physical images and have a laptop say it out loud.","['Many people with disabilities have impaired vision. They have to heavily rely on audiobooks, or braille to go through the day. However, not everything can be easy detected. Thus, this project aids them in reading all kinds of text. The vision is that this technology will be implemented in glasses so that visually impaired people can easily walk outside or do any normal activity without having to worry about anything. \n', ""It reads texts, slides, signs via a webcam and through a speaker tells us what's written.\n"", 'We built an app using python libraries which enables us to read the text via a webcam, and the image to text converter, which can be found in the library, can output the image as text instantly!\n', 'Using python turned out to be very challenging for both of us because we had 0% knowledge of this powerful language. It took us a lot of time to configure Kivy into our laptops, because it would cause random errors while downloading the libraries. We wasted around 4-5 hours resolving these errors. Other than that, it was super challenging for us when we started coding, because we knew nothing about python.\n', ""We were able to convert images to string and then do string to speech. This was a hard process as we didn't use any hardware. \n"", 'In general, we both learned a lot about Python Libraries and using Kivy. We also learned how to debug errors related to installing different libraries. We very well realized that each library is not accessible each very and therefore must be careful about using libraries and the python version before starting the project.\n', 'HearME has great potential in this age. It has a very wide scope in the future as it can be used on a large number of devices such as glasses, phones, etc. \n']","['python', 'pycharm', 'cmd', 'google-web-speech-api', 'opencv', 'pytesseract', 'pyttsx3', 'cv2']","False","0","['rishabmaheshwari', 'rshetty']","https://challengepost-s3-challengepost.netdna-ssl.com/photos/production/software_photos/000/883/201/datas/small.png","True","0"
"Tim Thundercore Token","Tim's token live on Thundercore","['\n', '\n', '\n', '\n', '\n', '\n', '\n']","['thundercore']","False","0","['tbeiko']","","False","0"
"Explore Holyoke","An escape-type game that introduces players to Mount Holyoke College by teaching them about the areas on campus and the core values of MHC by means of our campus’ urban legends.","['We know how easy it is to get distracted while looking at college websites during the application process, and we want to make college searching more engaging and fun, at least for Mount Holyoke College. By playing this game, people can learn about our college - its traditions, places, values and folklores.\n', ""It is a escape-the-place kind of single player game. The protagonist is our unofficial school mascot - Jorge the Goose. He gets lost in 'haunted' places on campus, and has to seek the help of the campus ghosts to get back home, on the way learning facts about Mount Holyoke College.\n"", 'We used Unity for programming; GIMP and Photoshop for digital art. We used real instruments for the background music and sound effects. All the voice-overs were done by us, using voice recorders. We also used SoGou Pinyin application to type in Chinese as well as EasyHindiTyping to type in Hindi.\n', 'Learning Unity on the spot was particularly challenging, albeit fun. As a team, we all participated in the Unity CrashCourse Workshop for a quick introduction. Nevertheless, it was tough figuring out how to take advantage of the existing library, how to manipulate text and display, especially with the program rendering bottom up, and programming collisions of the sprites was challenging. Overall, it was a fruitful experience attempting to learn a different language in a short amount of time. \n', 'We came up with an idea and was able to break it down into different parts of the problem to work on. We are especially proud of that each member was able to contribute and use their strength in either music, drawing, video-making, photoshopping, or programming. Communication was the key to our teamwork. We managed to work towards the same goal from different angles. Overall, our different backgrounds and specialties complemented each other very well.\n', 'We learnt to hone our skills like perseverance, passion, leadership, teamwork, delegation of responsibility. To let our creativity flow and and work well under pressure. We understood the importance of adaptability in life and how to change things on the spot when needed. We learnt to play to our strengths individually and come together and create something beautiful.We also attended a Unity crash course and learned the basics about game design using C#, which was something none of us had really done before.\n', 'First, we would love to incorporate more languages into our game to make it more accessible to more people. Right now, we have recorded the game dialogues in three languages (English, Chinese, Hindi). Second, we would love to include more stories-telling about Mount Holyoke to make it more informative. \n']","['unity', 'c#', 'gimp', 'powerpoint', 'word', 'google-drive', 'google-translate', 'google-docs', 'photoshop', 'atom', 'github', 'google-photo']","False","0","['ankasengupta', 'wang47s', 'pappa22c', 'chuang1990']","https://challengepost-s3-challengepost.netdna-ssl.com/photos/production/software_thumbnail_photos/000/883/026/datas/small.jpg","False","0"
"???","PogChamp","['Sob story about life\n', 'Stuff\n', 'Code\n', 'Everything\n', 'Nothing\n', 'Nothing \n', 'Thinking emoji\n']","['c++']","False","0","['zorathe']","","False","0"
"Schedul.io","Manage organization schedules to find the best meeting times","['\n', '\n', '\n', '\n', '\n', '\n', 'We are Inspired!\n']","['firebase', 'html5', 'javascript', 'python', 'flask']","False","0","['jackkolb']","","False","0"
