"Tree AI","An AI that cam compress Images of trees","['\n', 'Comnpresses Images of trees\n', 'I coded a neural network\n', 'Training\n', 'Making it output\n', 'A lot about AI\n', 'making it work for all images\n']","['java']","False","0","['anthonydigiovanna741']","https://challengepost-s3-challengepost.netdna-ssl.com/photos/production/software_photos/000/883/333/datas/small.PNG","False","0"
"Marketplace-Client","A local marketplace for everyone in your neighborhood!","['\n', '\n', '\n', '\n', '\n', '\n', '\n']","['java', 'android', 'gson']","False","0","['vkoutha']","","False","0"
"StudentCode","A place where students ","['\n', '\n', '\n', '\n', '\n', '\n', '\n']","['javascript', 'html', 'css']","False","0","['rohsaurus', 'matthiask31', 'dhruvachitneedi', 'tsundayclub']","https://challengepost-s3-challengepost.netdna-ssl.com/photos/production/software_photos/000/883/334/datas/small.png","False","0"
"HackMCST5","A tree clicker game","['\n', '\n', '\n', '\n', '\n', '\n', '\n']","['javascript', 'html', 'css']","False","0","['voidxpulse', 'sbrendan0']","","False","0"
"Hand Signal Recognition Software","A program that recognizes hand motions and responds accordingly in the form of images. It is demonstrated using the rock, paper, scissors game.","['\n', 'It responds to hand motions through a rock paper scissors game\n', 'We used python to create a system to recognize dots used to track fingertips\n', 'The background was constantly changing so it was hard to distinguish the hand\n', 'We managed to get the software to recognize hand movements\n', 'Libraries such as opencv and numpy\n', 'We will apply it to more complex signals such as sign language\n']","['python']","False","1","['kchaudhary22', 'ikansal22', 'jbrewster22']","","False","0"
"Cleanup Crusade","This is a short game designed to introduce players to ways of conserving pollution in a fun way.","['\n', '\n', '\n', '\n', '\n', '\n', '\n']","['unity', 'c#']","False","0","['ajog21']","","False","0"
"Tree AI","An AI that cam compress Images of trees","['\n', 'Comnpresses Images of trees\n', 'I coded a neural network\n', 'Training\n', 'Making it output\n', 'A lot about AI\n', 'making it work for all images\n']","['java']","False","0","['anthonydigiovanna741']","https://challengepost-s3-challengepost.netdna-ssl.com/photos/production/software_photos/000/883/333/datas/small.PNG","False","0"
"Marketplace-Client","A local marketplace for everyone in your neighborhood!","['\n', '\n', '\n', '\n', '\n', '\n', '\n']","['java', 'android', 'gson']","False","0","['vkoutha']","","False","0"
"StudentCode","A place where students ","['\n', '\n', '\n', '\n', '\n', '\n', '\n']","['javascript', 'html', 'css']","False","0","['rohsaurus', 'matthiask31', 'dhruvachitneedi', 'tsundayclub']","https://challengepost-s3-challengepost.netdna-ssl.com/photos/production/software_photos/000/883/334/datas/small.png","False","0"
"HackMCST5","A tree clicker game","['\n', '\n', '\n', '\n', '\n', '\n', '\n']","['javascript', 'html', 'css']","False","0","['voidxpulse', 'sbrendan0']","","False","0"
"Hand Signal Recognition Software","A program that recognizes hand motions and responds accordingly in the form of images. It is demonstrated using the rock, paper, scissors game.","['\n', 'It responds to hand motions through a rock paper scissors game\n', 'We used python to create a system to recognize dots used to track fingertips\n', 'The background was constantly changing so it was hard to distinguish the hand\n', 'We managed to get the software to recognize hand movements\n', 'Libraries such as opencv and numpy\n', 'We will apply it to more complex signals such as sign language\n']","['python']","False","1","['kchaudhary22', 'ikansal22', 'jbrewster22']","","False","0"
"Cleanup Crusade","This is a short game designed to introduce players to ways of conserving pollution in a fun way.","['\n', '\n', '\n', '\n', '\n', '\n', '\n']","['unity', 'c#']","False","0","['ajog21']","","False","0"
"QuizMonkey","It's a basic quiz with a little surprise at the end.","['\n', '\n', '\n', ""We're proud of creating it with such little knowledge of coding.We learned how to code using html and some basics of javascript.Built Withhtml      Submitted to    HackMCST V    Created by  Robert Neff\n"", '\n', '\n', '\n']","['html']","False","0","['votech107']","https://challengepost-s3-challengepost.netdna-ssl.com/photos/production/software_photos/000/883/322/datas/small.PNG","False","0"
"Gesture Arcade","Using gestures to control a game player.","['I wanted to create a platform where one could use physical gestures to control a player onscreen.\n', ""Tracks a Rubik's cube as a cursor to control a game piece onscreen.\n"", 'I used Processing to visualize and Java to write the code.\n', 'I had difficulty putting the different parts of the project together.\n', ""I'm proud that I got a working copy.\n"", 'I learned how to debug and speed code on a time crunch.\n', 'I hope to implement PacMan in the future and eventually expand to hand gestures.\n']","['processing', 'java', 'eclipse']","False","0","['leonxelric']","","False","0"
"Flixy","Flix for when you don't know what to pick","['\n', '\n', '\n', '\n', '\n', '\n', '\n']","['html', 'css', 'javascript']","False","0","['camilasuasnavar', 'kyranpark', 'caitlynparrish-lewis', 'samuelpaglingayen']","","False","0"
"Factory Simulator: Environmental Effects and Profit","Our idea is a factory simulator that allows the user to make choices in what happens their factory. The user must learn the balance between making a profit and supporting the environment.","['Our inspiration was the effects of massive of companies on the environment and how companies should emphasize the balance between making a profit and protecting the earth.\n', 'Our C++ program written in Repl.it allows the user to simulate what decisions factory owners have to make and the various issues that workers come across when working in factory that supports environmental-friendliness.\n', 'We used Repl.it and utilized out C++ coding skills.\n', 'Changing the numbers so that the game was able to be wonTesting the code and ensuring that the program worksTime constraintsAmbitionDifficultly with coding syntax## Accomplishments that we\'re proud ofOvercoming challengesWorking togetherAllowing for ## What we learnedC++ coding skillsTestingTeamwork## What\'s next for Factory Simulator: Environmental Effects and ProfitAdd more ""re-playability""Have more circumstances and issues for the user to overcomeBuilt Withc++repl.itTry it outfactorynew.artsygirl.repl.run      Submitted to    HackMCST V    Created by  I helped in testing and fixing bugs that we discovered. I also assisted in coding the elements of the program.Humna SultanI helped by developing ideas,  coding and testing the program. Ananya NadendlaI helped develop the idea, coded, and tested the program.Adrianna BordonaroI helped Q&A test aswell as help creating ideas, create some methods within the code.Nathaniel Carlyon\n', '\n', '\n', '\n']","['repl.it', 'c++']","False","2","['humnasultan', 'ananyanadendla', 'adriannabordonaro', 'nathanielcarlyon']","","False","0"
"BlindVision","An app for blind people to help them be more aware","['\n', '\n', '\n', '\n', '\n', '\n', '\n']","['dart', 'flutter', 'python']","False","0","['askagranya1064', 'saiveer04']","","False","0"
"AI Money Manager Chatbot","A way for people to manage their money and finances online with an always available AI.","['We wanted to help people manage their money and finances.\n', 'It is a chatbot that allows people to have a always readily financial outlook. It gives people a savings goal and shows their events, which they can then write a budget for. They can also see if they can buy several things without going past their savings goal. Finally, they can tell whether you are paying more than average for some utilities.\n', 'We wrote some dialog to make a chatbot on dialogflow, and sent the information it gathered to Javascript. We used this to generate a response and add things to google calendar, and do calculations based on savings.\n', 'It was pretty hard to connect to Google Calendar API, and it took a lot of different approaches. We also had to restructure the code to be able to respond to all three parts of the chatbot differently.\n', 'We are very proud of finally getting the connection to Google Calendar API working permanently. We are also proud of making the chatbot fully functioning.\n', 'We learned how authentication with APIs work, and i also learned how personal finance works.\n', 'We could add functionality for Google Home and Alexa in the future. We could also add different events into it, and maybe somehow connect to a site like paypal to automatically pay.\n']","['dialogflow', 'javascript', 'heroku', 'github']","False","0","['siddhantdesai04']","https://challengepost-s3-challengepost.netdna-ssl.com/photos/production/software_photos/000/883/330/datas/small.png","False","0"
"The Academy Games of Memory","The idea for this game is to draw the user into using their prior knowledge in academy types mixed with memory to match academies. ","['\n', '\n', '\n', '\n', '\n', '\n', '\n']","['html', 'css', 'javascript']","False","0","['saakshimunot', 'carlygladstone', 'suchiborkar', 'munotsehaj']","","False","0"
"Terry the Auto Troller","An auto-troller that roasts anyone on their twitter bios.","['The need to troll celebrities fast.\n', 'Open the target celebrities page, hit ctrl+alt+shift+r, a ""roast"" is selected based on the celebrities name and bio, and is copied to your clipboard, ready to be spammed.\n', 'We used autohotkey to call a python script that takes an input of the twitter handle, and produces a roast.\n', 'Connecting auto hotkey with python.\n', ""Literally everything, we're just bad.\n"", ""That we're bad.\n"", 'Make it work for Tinder bios.\n']","['autohotkey', 'python', 'pyperclip', 'git', 'github', 'pycharm', 'requests', 'time', 'cmd', 'brainpower', 'reddit', 'covfefe']","False","3","['d8parikh', 'abbiram', 'deltaeagle11022', 'sidg2k1']","","False","0"
"Prompt Provider","An email reminder system.","['We decided to make this since one of us had figured out how to send an email from python. \n', 'A website that would create and email notifications during a given time.\n', 'we used html and css to style the website. We used java script to control the buttons, and python to send the emails.\n', ""We lost a file. We couldn't find our idea for a while. We couldn't figure out how to use the python file from the javascript file.\n"", 'We made a comeback, when we \n', 'Always have a back up. Get better at time management. Work better together as a team\n', ""We'll add a better user interface, as well improve functionality\n""]","['javascript', 'css', 'html', 'python']","False","0","['brianhuang', 'jonathankirspel', 'aydincoutts', 'lukecrimi']","","False","0"
"VSCO Adventure","A fun and easy game following the travels of Bella, the VSCO girl. Bella has to collect hydroflasks on her journey to the metal straw!","['We have a passion for saving turtles and our planet and so we wanted to create a game that effectively conveyed our message. We chose the VSCO theme as it would reel audiences in and attract them to play our game while communicating our message.\n', 'It is a game with the objective of collecting hyrdoflasks (a trendy thermo-insulated water bottle) and passing on platforms to win a metal straw to save the turtles. \n', 'We used the coding software, ""Scratch"". \n', 'We could not figure out how to get the VSCO girl, Bella, to move correctly in the right direction. \n', 'This is our first hackathon, so this is a huge accomplishment for all three of us. \n', 'We learned how to put together lines of code to create a fun and adventurous game!\n', 'We hope to make the game more popular by sharing with all of our friends and creating more challenging levels! Try it outscratch.mit.edu      Submitted to    HackMCST V    Created by  Mahi AhmedKareena Khubchandani\n']","","False","0","['mahibahahmed', 'kareenakhubchandani']","https://challengepost-s3-challengepost.netdna-ssl.com/photos/production/software_photos/000/883/324/datas/small.PNG","False","0"
"lego-that-screams-when-you-step-on-it-++-brightness-analyzer","its a lego that screams when you step on it combined with standalone photo brightness analyzer","['discord, our lord and saviour\n', 'its a green lego brickif u step on the lego brick it will scream at uinsovietrussiayoudontscreamfromlegobricklegobrickscreamfromyouu can also make get request to the following path: /img/ where data is the base64 encoded data of your image using (+-) as altchars instead of (+/) and the program will preform complex analysis on your image\n', 'we made an app that uses camera library for react nativethe camera periodically takes screen shotsit converts the image data into base64 with ""+-"" as the alt chars (for url format)it sends it to the server with a get requestthe server performs image analysis using complex algorithms and data structuresthe result is packed into a compact JSON format and sent back to the clientthe client uses the data to decide whether a foot is stepping on the brickif something is stepping on the brick it screams\n', 'it was hard to take sexy pix with react native\n', 'IT WORKSSSSSSSSSSSSSSSSSSSSSSSSSSSSSSSSSSSSSSSSSSSSSSSSSSSS!!!11!!@@!!@!@!1!!!!!1!11!!!!\n', 'how to take pictures using react native\n', 'more machine learningblockchainreduce latency by using distributed computer systemsk u b e r n e t smake it into a node.js module\n']","['react-native', 'python', 'javascript', 'html5', 'jsx', 'flask', 'hardware', 'azure']","False","1","['plasmatic1', 'pidddgy', 'readlife2000']","https://challengepost-s3-challengepost.netdna-ssl.com/photos/production/software_photos/000/883/295/datas/small.jpg","False","0"
"Roar","An app for reporting poaching, trafficking and other illegal animal activities while rewarding the reporter.","['Empower citizens and communities to conserve their native wildlife while building a foundation for sustainable prosperity\n', '\n', '\n', '\n', '\n', '\n', '\n']","['pytorch', 'flutter', 'nltk', 'adobe-xd', 'dart']","False","0","['seedambieread']","","False","0"
"ASL Live Translator","This program will allow those you use ASL to communicate to interact with those who don't know ASL. The program recognizes individual letters and translates them in real time.","['\n', '\n', '\n', '\n', '\n', '\n', '\n']","['javascript', 'html', 'machine-learning']","False","0","['billyjets3', 'maxwellfaluotico']","","False","0"
"Biasd","Allowing users to learn more about twitter -- and themselves.","['Politics, especially partisan politics, have reemerged in the news in recent times. From the democratic primaries to the impeachment inquiry of President Trump, the public is being flooded with new information. One of the largest sources of this information is Twitter, which is also the preferred form of communication for President Donald Trump. So, we wanted to do something to better understand the information stream of twitter, and we immediately thought of replicating the tweets are a way to discern, as an information consumer, what is false and what is true. \n', 'Our creation allows users to understand their inherent bias, as well as the leanings of twitter. It is a novel way for users to understand the queries that they otherwise would just enter into the search bar of Twitter. Ultimately, Bias allows readers to understand Twitter-and themselves. The user is prompted to enter search queries, from which results are pulled and fake data created. The user then enters this game-like scenario in which they have to choose whether or the tweet is real. In the end, the user is shown a comparison of the sentiment of their favored tweets, as well as the liberal and conservative leanings, as compared with their choices. In the end, they also receive an accuracy score of how accurate they were at discerning what is right and what is wrong. \n', 'The application itself is built on Flask and then hosted locally. The user search query is passed to the Twitter API, from which tweets containing the word are selected. From this corpus of relevant tweets, Markov chaining is used to generate semantically similar tweets. The output is displayed using Charts.js and presented to the user. \n', 'For us, the largest challenge was the segmentation of what we were trying to do. We knew that together, the various parts of the creation (from the fake tweets to the sentiment analysis) would be technically impressive but from a social perspective, meaningless. We knew that each part we could reasonably get running, but we wanted to create a cohesive end product that included all of these parts to best represent how inherent bias affects the understanding of how Twitter information is perceived.\n', 'We are most proud of the integrative system and the game-like mechanism for comparison. We think that asking the user to label tweets would have been boring, and taken away from the individual accuracy of some of the fake tweets. So, we wanted to highlight not just the individual tweets but also the aggregation of the data that gives insight into the user, and having this two-page system allows for that. We are also very happy with the believability of these fake tweets, which surprised us after running the Markov chain generator multiple times. This is especially impressive considering the fact that we had to handle hashtags and mentions, which are very common on Twitter.\n', '\n', 'The next step for Bias will be to expand the features that we can glean from the information we get. In keeping to a Twitter base, we can also get information about the other types of political parties, such as libertarians or socialists. We don’t want to characterize information as either liberal or conservative, as this is a dichotomy that we hope to break and also inherently part of our bias as developers. We’d also potentially want to expand beyond the Twitter corpus and move to other text-based systems such as Reddit, for example. And of course, we’d like to put this out on the web, where everyone can enjoy it, not just us!\n']","['python', 'flask', 'indicoio', 'twitter', 'chart.js']","False","0","['igalakhov', 'yashparikh02']","https://challengepost-s3-challengepost.netdna-ssl.com/photos/production/software_thumbnail_photos/000/883/283/datas/small.png","False","0"
"Weasel","Encrypted chats wherever you are.","[""Encrypted chat apps are a dime a dozen, but what if you're in a country with poor mobile data support, or censored internet? Privacy is an inalienable right that everyone deserves, including those in said areas.\n"", 'It uses existing SMS infrastructure with military-grade encryption to keep all messages secure, not needing internet or data.\n', 'We forked an existing reliable SMS client, QKSMS, and added on end-to-end encryption. \n', 'The internet connection and web blocking made it hard to get all the tools we needed in a timely manner.\n', ""It works! It's encrypted and entirely independent from any servers.\n"", ""Kotlin is hard. So is Android dev. It's very hard.\n"", 'A decentralized key management system and extensible app you can download from the Google Play Store.\n']","['java', 'kotlin', 'android', 'android-studio', 'intelli', 'intellij-idea', 'aosp']","False","0","['frankgomes']","","False","0"
"Math.io","To be able to educate viewers about math and practice your math skills","['We saw that kids have a hard time to practice and learn math and found a way to incorperate fun into math\n', 'Allows viewers to practice their math skills and also reviews it.\n', 'We brainstormed multiple ideas and then picked the best ideas. Then, we started building our project and also followed some tutorials on the times we did not know how to write the code.\n', 'Some challenges that we faced as we went along with our program was making the website more user friendly, and making it look colorful, and nice. Also, figuring out some of the code for certain sections was a challenge, as well as figuring out what went wrong if the code was incorrect. However, we got past all of these challenges, and eventually understood what to do, and what we did wrong.\n', 'Some accomplishments that we are proud of are linking all of the websites together within different buttons, the abulity t hover and change the color of a button, creating a miniature version of the 2048 game, learning mre javascript, and designing our website to be easy to navigate and look visually appealing to the users.\n', 'We learned more about javascript, css, and HTML and how to incorperate into our website\n', 'Adding more games that that focus on development of specific topics of mathamatics. Also, adding more visuals that are appealing to the learners. This website would be more developed and will fully achieve what it is meant to achieve; helping children all over the world. \n']","['css', 'html', 'javascript']","False","0","['cmmatrubai23', 'shivpatel145', 'nmakkithaya23', 'jaisalp2005']","","False","0"
"World Crises","It is a website designed to spread awareness of world wide issues.","['We thought we could do our part in helping countries around the world resolve their crises by creating an informational website.\n', 'The website lists some countries and their crises as well as a charity organization that helps solve these problems.\n', 'We built it using HTML5, CSS3, and JS. We started off by building a framework for the website then implementing the data and design.\n', ""A challenge we ran into was an issue of the website not fitting different computer resolutions. Another challenge is that we had to learn the right syntax for languages that we weren't too experienced in.\n"", 'We are proud of creating an ascetically pleasing and functional website based off of our beginner knowledge  and perseverance. \n', 'We learned of the hard work it takes to create a polished and functional website.\n', 'Creating a game using Java or C++.\n']","['html5', 'css3', 'javascript', 'code.org-local-school-database']","False","0","['skoumyem']","","False","0"
"Periodic Table Study Guide","A database for all 118 known elements on the Periodic Table","['Students at MCST complaining about the lack of a single clear and concise database that they could find information about all of the elements on the Periodic Table for their science class. A sophomore, Mahi Gupta told us that she found it difficult and inconvenient to have to refer to the textbook and the Periodic Table for all of her assignments.\n', 'It uses user input to switch between different pieces of information about the different elements to provide relevant information to help the user study the periodic table\n', 'We built it using a large if block, which has a section for each known element, and contains information on said element.  We used a while loop to surround the program so that the user only needs to run it once, and we created a second, smaller while loop at the end for the user to stop the program.\n', 'We were unable to use a switch block because of our relative confusion surrounding them, and the fact that we did not know how to add separate parameters to each switch. We also struggled with making our code concise, while still functioning as intended.\n', ""It works properly, and it contains general information about each element, the number of protons, neutrons, and electrons usually contained in each element, and each element's standard atomic mass.\n"", ""We learned much about each element's history, as well as the history of the Periodic Table as a whole. We learned about the different qualities of different elements, as well as when they were discovered. For example, did you know that two elements have been discovered since November of 2016?\n"", ""We will work on updating it as new elements are discovered, as well as adding additional information as it's discovered because the newer elements on the Periodic Table have very little information about them. We will also work on adding additional criteria to search for elements by, and smoothing out bugs that occur as we expand the database.\n""]","['java']","False","0","['roseluciano', 'ianelias', 'jakubszacillo']","","False","0"
"Current Issues Help Website","Do you want to make a change in this world? You can get started here. This is the place to learn a little bit about current world issues and how to help.","['I always wanted to help people in need and find out how exactly I could help, so I made this website.\n', 'It gives some basic information about various issues and provides links to other sources of information and ways to help.\n', 'I used TextEdit and coded the website in HTML and CSS.\n', ""I worked on this project by myself and there was less time than I expected. Plus, I only knew some HTML and I had to learn it quickly. I didn't have enough time to make the website look professional. I also had to do a lot of research while making the website, which took a lot of time.\n"", 'I made my first website in a limited amount of time. I was also able to learn enough HTML to make the website.\n', 'I learned how to make a website from scratch and how to help the world.\n', 'I want to make it look more attractive and add more information.\n']","['html', 'css']","False","0","['roshnikainthan']","https://challengepost-s3-challengepost.netdna-ssl.com/photos/production/software_photos/000/883/277/datas/small.png","False","0"
"Twisted Tetris","Your favourite arcade game, with a twist.","['To create a warped and twisted game!      Submitted to    Terrible Hack XIV    Created by  Karl Zhu\n', '\n', '\n', '\n', '\n', '\n', '\n']","","False","0","['theman44']","https://challengepost-s3-challengepost.netdna-ssl.com/photos/production/software_thumbnail_photos/000/883/275/datas/small.PNG","False","0"
