"FloodGate","Leveraging Crowd-Sourced Data For Early Flood Warning &amp; Detection","[""Today's world increasingly interacts with natural disasters and climate phenomena, in large part caused by anthropomorphic global warming, For many of us, not only in the US but also around the world, access to definitive pipelines for connections and educational resources is severely lacking, and thus FloodGate provides a streamlined path to help the students, community leaders, and people of the future get a headstart.\n"", 'FloodGate has several functions. The SMS notification system provides persons in need with easy, reliable, and secure access to responders and volunteers, and its intended purpose is to help users identify key events established during the path of a natural disaster so they can make more informed decisions and gain vital contact/rescue information. FloodGate also implements an autonomous, remote, and cheap sensing device, built with multiple contact functionalities and messaging services. This is all compiled into an accessible, user-friendly website which includes resources to heatmaps and real-time models of natural disasters.\n', ""Twilio API (SMS), Google Maps (GCP), Flask, and NgrokFloodGate's creation required building and utilizing functional RESTful APIs and packages to create a responsive site. The site is styled via Python's Flask library. The backend server is supported by Ngrok, providing localhost access to webhooks. The SMS ping system is backed entirely by Twilio's Programmable SMS API, providing FloodGate users and first-responders with RESTful, real-time notifications. We also use Firebase's Cloud Firestore database service to host our sensor and SMS data (with SQLite3 as an offline backup) and GCP's Google Maps Platform to display location-based data on interactive maps.Arduino, C, Python, Matplotlib and a Whole Lot of SolderThe FloodGate sensor is built using an Arduino 101 and Ultrasonic Distance Module HR-S04 using the established Arduino IDE and C. Serial data is handling via Python's PySerial library.\n"", 'It was my first time making an actual project on an Arduino, and I had never really used Flask before. In the process of making the site, I ran into several production issues with Ngrok. Additionally, I encountered difficulties connecting to the development server on several instances, and the Twilio versioning proved challenging for the back-end.\n', ""I'm amazed that I was able to complete FloodGate over such a small duration, especially considering my lack of experience with Flask and Arduino. I faced many set-backs with the site interface, so ultimately having a working version of the site pushed into production was extremely fulfilling.\n"", 'Coming into this project as a Flask novice, I had absolutely no experience with anything related to the Twilio API, and minimal experience with Ngrok servers and design. However, I managed to bridge this gap by constantly pushing myself to learn more about C, poring over documentation, and seeking help when needed on StackOverflow and Google. Ultimately, I needed to think and rethink the overall coding process, and finding that common ground and challenging myself to truly understand code instead of haphazardly copying it from forum pages really allowed me to progress. I was also able to experiment with new technologies such as Cloud Firestore, SQLite3, Ngrok, and others.\n', ""I hope to expand the site into a fully integrated site complete with enhanced user experiences and design. I'm also actively pushing myself to create an iOS app for FloodGate, which I hope to push into production soon! Stay tuned for more updates!Made with ❤ in 2019\n""]","['ngrok', 'python', 'flask', 'twilio', 'google-maps', 'google-cloud']","True","2","['nikhil-vytla']","https://challengepost-s3-challengepost.netdna-ssl.com/photos/production/software_thumbnail_photos/000/881/153/datas/small.png","False","0"
"hackdukef19","Buzzle is an energy savings calculator that allows individuals who want to become more environmentally-conscious and sustainable by quantifying their energy use","['\n', '\n', '\n', '\n', '\n', '\n', '\n']","['html', 'matlab', 'javascript']","False","0","['beckadd']","","False","0"
"Disaster Relief &amp; Recovery Application (DRRA)","Providing tools to both local government and residents are essential for properly handling a disaster, including analyzing large amounts of data and having resources to get what you need. ","[""After doing research on the biggest problems people face when it comes to natural disasters, I realized it could make a huge difference if people had the proper technological tools to handle the most common issues. I developed software that first responders and local governments can use to evaluate the impact of the disaster, and a phone application that residents can use to quickly see what's going on. \n"", ""The Java software for first responders and local governments scrapes social media by hashtag or a list of residents, scans the images uploaded which can be sorted by date, uses AI to evaluate what's going on in the pictures, sends the data from Google Cloud Platform to MongoDB Atlas, and then sends the data to the java application to be viewed by the user.The phone application allows residents to see local news stories quickly, request items, request assistance, see if other neighbors are meeting up, and see who else needs help and if they can help themselves. \n"", ""I used Java for the first responder software, Maven to use the MongoDB, Jackson and JSON repositories, and Google Cloud Platform and MongoDB to handle the movement of the scraped images and AI scanned data in the cloud.I used Xcode and Swift to make the phone application, which uses Google Firebase for a login system (logging in isn't required but helpful), and has a Feed, Assistance, Meetings and Settings pages. I used CocoaPods to use Firebase in the application. \n"", ""I never have programmed for a database before in the cloud, never have done anything with AI or any scraping of anything online. I only had Java experience and iOS app experience from previous HackPSU's. I was somehow able to get the AI to work, send data to MongoDB, and bring that data back to the java application to be viewed by the user. I slept just under 3 hours. \n"", 'The AI actually scans the pictures and returns the resulting keywords and how likely they are true to the Java application after the scraped images are uploaded and processed. The software package gives everyone a tool to use during a natural disaster and for recovery. \n', ""I learned how to work with a MongoDB Atlas database and the collections. I learned how to connect Google Cloud Platform to MongoDB, and how to connect MongoDB to a Java application for the movement of data. I learned how to use Google's Cloud Vision API. \n"", 'If both sides are finished, the application could prove extremely useful for residents, especially if the Twilio text messaging service could be implemented for returning updates on the situation without internet access. The first responder software can be used to quickly evaluate the situation of local areas in minutes. \n']","['swift', 'java', 'googlecloudplatform', 'mongodb', 'cloudvisionai', 'instamancer', 'maven', 'jackson', 'json', 'mongodbdriver', 'xcode', 'adobexd', 'firebase']","False","0","['jacobmakarsky']","https://challengepost-s3-challengepost.netdna-ssl.com/photos/production/software_photos/000/881/262/datas/small.png","True","2"
"Disaster Map","An app to send your last known coordinates to the disater site. The app holds the last location of the user. Responders have access to a map with the last known locations. ","['Help facilitate and expedite the process of rescuing victims of natural disasters by creating an easy to use visualization of who needs rescuing and what they need.\n', 'Organizes survivor information by location and type of need. Allows first responders to see locations of victims to facilitate easier rescue.\n', '\n', 'We ran into lots of challenges getting the APIs to work with each other. We also ran into difficulty integrating HTML, Java, and Javascript to run together well.\n', 'We were proud of the Java and Javascript integration and learning many APIs in a short amount of time.\n', 'The main thing we learned was how to use many different APIs and integrate them well within our program. Early application architecture was also necessary. We also learned some basic JavaScript and how to integrate it well with Java.\n', 'We would like to display satellite images from another API. We would also like to use Google Cloud to integrate large sets of data. We believe it would have the bandwidth and space required to handle the large amounts of data that would be needed in a crisis.\n']","['java', 'javascript', 'html5', 'twilio', 'google-maps', 'particle']","False","2","['tkk5189', 'jackblicha', 'cpb5435', 'mschiffh']","","False","0"
"Shark","We created The Shark Project to help people in San Francisco to easily find a street parking. This is a mobile app designed for users to be a giver or taker of a parking space.","['Everyone knows how hard it is to find street parking in the busy city of San Francisco. As a group, we have all had experiences where we go into the city for a shopping trip, a stroll around Golden Gate park or even an hour-long job interview, but end up wasting the day looking for cheap parking. According to an Inrix study of 6,000 U.S. drivers in 10 American cities, the average San Franciscan driver spends 83 hours a year looking for parking. During this time, these drivers add to congestion and air pollution while wasting gas money. So we decided to make a solution to this problem! \n', 'Recognizing this problem, we have created a marketplace to connect drivers looking for parking spaces (""takers"") with drivers leaving parking spaces (""givers""). The website is able to use the destination and preferences of a “taker” to match them with a nearby ""giver"". ""Takers"" pay for the convenience of knowing where the spots are while ""givers"" are compensated for waiting for the ""taker"" to arrive. \n', 'Our website is built as a prototype in Sketch.\n', 'Some challenges that we have faced: finding an effective way to lay out the step-by-step process for a user who is utilizing the website. Also, we struggled with the level of technical knowledge within our group. \n', 'We are proud of our prototype and the idea of our project because it benefits our group members as well as the city of San Francisco.\n', 'We have learned how to work collaboratively with each other. By presenting different ideas for this project, we have been able to discuss the simulations for each outcome within the project so that we could build something successful. \n', 'We are confident that our idea is strong enough to be distributed in the city, so we will learn how to build the mobile app to make this idea into a reality. Try it outdocs.google.com      Submitted to    Girls in Tech Hacking for Humanity 2019    Created by  Karina IslamRoseline TayehChandravadani DeavarathnamHana Oshima\n']","","False","1","['karina13aust', 'rtayeh', 'chandravadani', 'hanasoshima']","","False","0"
"DocDocGo","What Docs Can Do For You -- At a Reasonable Price!","['\n', '\n', '\n', '\n', '\n', '\n', '\n']","['python', 'r']","False","0","['isabellawang', 'jgupta0700', 'congfeng22', 'liuyj8526', 'humashashmi']","","False","0"
"disast-ar-relief","Augmented Reality App that helps disaster relief and recovery efforts. ","[""Back in 2016, an earthquake hit my country. During that time many roads got destroyed and many people did not get assistance on time. What if authorities or anyone could construct temporary roads with just their phones? What if we could get a distress signal from someone close and help them before it's too late? \n"", 'Allows users to trace alternative VIRTUAL ROUTES. This route can include warnings, notes, anything that can help first responders and anyone really.Allows users to see nearby SOS signal.Allows users to send an SOS signal for others to see.\n', 'Used ARKit to trace paths.Used MapKit to see SOS signals and send SOS signal.\n', 'I was having trouble displaying location of other users.Also had trouble displaying my own location and updating annotations.\n', 'Able to trace a path of virtual crumbs for anyone to see.Able to see a note left in the path when is inside the camera view.\n', 'Learned how to work with mapping data.Learned the fundamentals of augmented reality app development.\n', 'Share paths with other users by uploading to a database.Add a mesh network, so the app can be used without internet connection.\n']","['arkit', 'mapkit', 'swift', 'ios']","False","0","['nelsondaniel']","","False","0"
"PenniesForGood","Help round up online purchases to donate. Micro donations for macro impact.","['We were inspired by a combination of the tracks offered here at HackDuke. Although we were technically limited to just one track, we wanted to try our best and influence all five tracks - helping nonprofits that support education, socioeconomic inequality, health and wellness, and in the future, hopefully also benefit energy and environmental nonprofits. Our idea was founded based on tip jars and “rounding up” at gas stations and restaurants, where even the smallest amount can go a long way. We truly believe that we can make a macro difference with microdonations.\n', 'PenniesForGood is a Chrome extension that is activated when a user clicks the “add to cart” button on an online purchasing platform. It will prompt a user to round up their final total to the nearest dollar, whether it be 1 cent or 99 cents, and if the response is yes, a list of charities that are related to their purchase will pop up, following the psychological “jam theory”, to encourage users to select a charity that matters to them to donate too. Our data is also accumulated within a progress bar page that showcases a progress bar to our nearest goal that updates every time someone clicks yes!\n', 'Our Google Chrome extension is built using Javascript, CSS, and HTML as the overall framework. We first created our chrome extension template and the extension window that gave information on PenniesForGood and directed users to a graph of their charitable progress in the 3 tracks we created (education, health, hunger). Then we created a buy window that would be enabled when the “add to cart” button in Amazon is clicked. This button will link to another popup that will prompt the user to donate, telling them how much we round up the price too. If the user says says, they are directed to a list of 3 charities based off of the product they bought (e.g if a user buys instant ramen, they are directed to charities looking to address hunger). This price is then updated appropriately in the Amazon checkout. Our data is also accumulated within a progress bar page that showcases a progress bar to our nearest goal that updates every time someone clicks yes!\n', 'The first challenges we ran into is that because most of us are novice hackers, we had to learn html, css, and js and the combination of the three to build a chrome extension website. We had to learn how to build progress bars, how to overlay chrome extension pages, how to use the chrome storage, and how to even modify the amazon website, and much more.We constantly ran into errors, debugging problems, buttons overlapping, text not formatting, connecting different files in our project and many more. We wanted to make something that worked, yet didn’t want to make it out of the scope of our abilities.\n', 'We were very proud of being able to work so efficiently and cohesively even though most of us had never participated in a hackathon before. \n', ""Some of us had never coded in HTML/Javascript before, so it was a completely new experience for us. In addition, we learned the importance of communicating with each other about pushing and pulling to git. What's next?We want to implement a user login system to keep track of each user’s donations. We want to increase a bigger database of charities and we want to be able to spread it to far more different online platforms. We also hope to improve the user interface to make it more user friendly and cleaner-looking.Built Withchromecsshtml5javascriptTry it outgithub.com      Submitted to    HackDuke: Code for Good 2019Winner                Coding it Forward Winner: Nonprofits Track                  Created by  I worked on web parsing to identify the prices of products and types of products. I also worked on linking buttons to make windows pop up and close.Alex ZhuangI built the progress bar page to show the overall progress made for total donations for each track. I also worked on the design for the extension window and progress window.geshnaI worked on setting up the Chrome.storage.sync API to store the total donated values for each charity and add the donation from each user.Annie WangI designed the logo for the PenniesForGood chrome extension. I also built the charity selection page, the thank you page and the charity category selection based off the product bought.Raymond LinI built the chrome extension page. helped with the progressbar, brainstormed the idea, assisted with the js implementation of various parts.Andrew Wu\n"", '\n']","['chrome', 'html5', 'javascript', 'css']","True","1","['azhuang639', 'geshna', 'anniedde', 'rlin264', 'awu339']","https://challengepost-s3-challengepost.netdna-ssl.com/photos/production/software_photos/000/881/197/datas/small.png","False","0"
"Connect","To help people who are not good at initiating conversation and get in touch with the people around them.","['Our inspiration comes from finding those interested in studying the same topic but are disconnected from one another. With this app, users are able to know when others are studying for an upcoming exam and are able to join them without necessarily being close to them. \n', 'Once you have setup the app, the application will display a map of the people around your current location. From there, you can see the statuses of these people ranging from studying for exams to eating alone at a restaurant. Clicking on a person with a status will prompt you to ""wave"" or add a friend request. Afterwards you have an option to communicate with the corresponding person and eventually get together for a study session or simply lunch. \n', 'This was built using android studio, firebase, and MapBox. \n', 'Using MapBox APIs. Connecting and setting up database.Understanding Android Studio.Combining design with code.\n', 'Designing our app with a working live database that is also visually appealing for the user. \n', 'Limitations and benefits of firebase.How to create an app using Android Studio.Java\n', ""There's a lot more that needs to be completed. The UI requires a lot of work from tapping on an icon on the map to display more information to a detailed profile.   \n""]","['android', 'android-studio', 'java', 'mapbox', 'firebase']","False","0","['ihm5020', 'williamkucds', 'bchu7796']","","False","0"
"Safeify","Help stop fires and report public infrastructure problems","['After seeing the fires in Northern California, and reading articles about the state of the utility lines, we thought of making Safeify.\n', 'Safeify allows users to report issues with utilities that cause public safety hazards so that the utility companies can know which items to focus on. Once the item is selected, it will be sent to the public utility to help them prioritize their order for fixing the infrastructure issues. Users of the app can also see the reports sent.View the demo here: https://github.com/jakechasan/HackDuke19/blob/master/HackDuke19%20Demo.mov?raw=true\n', 'Swift, Google APIs, Firebase, Apple APIs\n', 'None\n', 'Cloud syncing, user interface\n', 'We learned the updated APIs for Firebase.\n', 'The next steps would be to build out a more comprehensive map view, and a more comprehensive submission view.\n']","['swift', 'google', 'apple', 'ios']","False","0","['jakechasan']","https://challengepost-s3-challengepost.netdna-ssl.com/photos/production/software_photos/000/881/099/datas/small.png","False","0"
"GetOffTheRoad","An API and notification service for forecasting the safety of your daily commute.","['Reduced visibility, rain, and snow are among the top predictors of traffic fatalities.  Our project takes a data-driven approach to risk analysis through weather APIs and modeling of crash statistics, making the world a safer place one text at a time!\n', ""GetOffTheRoad is a public API for predicting the 'drivability' of a user's commute.  The project is presented as a webpage where a user may sign up to receive a daily text message describing the weather and road conditions in their city.\n"", 'The demo web application uses the Accuweather API to gather historical and forecasted weather data in the user’s location.  Each datapoint is configured in our algorithm with adjustable weights, which are tuned to aggregate a relative safety score from 0-10.  The backend is implemented with a Python Flask server on an Amazon EC2 box.GetOffTheRoad uses the following technologies in the sample implementation:Twilio Communications APIAccuweather APIApache HTTP ServerPython / Flask Web FrameworkMongoDBAmazon Web Services (Ubuntu EC2 Server)\n', 'One of the major difficulties in implementing the drivability score was the lack of historical data and crash statistics for tuning the regression coefficients used to factor the score.  This model will need to be improved in the future though more powerful APIs and larger datasets.\n', 'We managed to assemble a working website with text notifications, data analysis, and a user database all in 24 hours!\n', 'None of our team members had significant experience with web frameworks.  We gained valuable experience with jQuery, Flask, and REST APIs while implementing the demo web application.\n', 'To further improve the usefulness of the drivability score, our algorithm could utilize machine learning to correlate crash reports with existing weather data to improve the weights of each datapoint.  This would require a subscription to a traffic condition API such as Google Roads API, which we could use to build a dataset for training. A multivariate linear regression can then be trained by gradient descent, minimizing an error term equal to the distance between predicted traffic fatalities and historic trends. The result would be a robust tool for predicting the weather-adjusted risk of driving in a given area. \n']","['accuweather', 'twilio', 'python', 'flask', 'mongodb']","False","0","['cjgriscom', 'vennilapugazhenthi']","https://challengepost-s3-challengepost.netdna-ssl.com/photos/production/software_thumbnail_photos/000/881/284/datas/small.jpg","False","0"
"Offensive Language Convolution Neural Network","Although our network only represented cases of Racism/Sexism, we believe with the correct datasets that this neural network could be expanded to represent all cases of offensive language.","['\n', '\n', '\n', '\n', '\n', '\n', '\n']","['we-trained-a-neural-network-using-4', 'python', 'firebase', 'css3', 'html5', 'pytorch', 'tensorflow', 'cnn', 'google-cloud', 'keras']","False","0","['achung3']","https://challengepost-s3-challengepost.netdna-ssl.com/photos/production/software_photos/000/881/067/datas/small.png","True","0"
"NittanyChain","Securing our school currency with cutting-edge blockchain technology","['\n', 'NittanyChain secures all transactions via the blockchain: so whenever a student spends any money within their LionCash  Account, NittanyChain creates a new block with the information about that transaction. Then, to ensure that the details of the transactions are secure, the hash value that is generated by the blockchain is then solved by miners, similar to how many cryptocurrencies manage their blockchains today. However, instead of offering LionCash to a stranger who mines this blockchain, NittanyChain will offer amounts of Cryptocurrency as a reward (such as Ethereum). In order to prevent a 51% attack on the chain, NittanyChain will be mined by a Penn State-confirmed group of miners who will correctly mine the first few blocks, so that when the blockchain becomes open to the general public of miners, forks in the chain will become less probable. \n', 'We built the blockchain using java IDEs Intellij and Netbeans, and we enlisted the help of a few coding mentors. \n', 'We ran into many challenges in compiling the code. The coding part was the most grueling due to the nature of blockchains and our previous inexperience in ever creating a blockchain. However, we were able to learn many things about how the code behind a blockchain works. Specifically, we ran into challenges with abstracting the code and having the main Java class, where the interaction of a person making a transaction is made, triggers the addition of a new block in the blockchain. We also had difficulty abstracting most of the code into more efficient classes and methods so we could solve the previously mentioned problem.\n', 'We are proud of this entire project within itself, as we embarked on doing something none of us had previously had much experience prior to this Hackathon.\n', 'We learned about the possibilities of blockchain, how a blockchain is coded and created, and how the blockchain interacts with external resources ( such as the code behind a transaction).\n', 'We will work on making sure the code compiles for NittanyChain, fixing the main Java class to eliminate compiling and runtime errors, and we will fix any issues between the blockchain code and the transaction code that triggers the addition of a new block to the blockchain.\n']","['intellij-idea', 'netbeans', 'java', 'visual-studio-code']","False","1","['wa1mart', 'rparmar01', 'nimeshsilva']","","False","0"
